Question,Count,Excellent (%),Very Good (%),Good (%),Fair (%),Unsatisfactory (%),Course Mean,FAS Mean
Evaluate the course overall.,142,27,32,23,11,7,3.61,4.25
"Course materials (readings, audio-visual materials, textbooks, lab manuals, website, etc.)",135,36,30,21,12,1,3.87,4.25
"Assignments (exams, essays, problem sets, language homework, etc.)",141,22,31,18,19,9,3.38,4.12
Feedback you received on work you produced in this course,139,22,29,29,15,4,3.5,4.13
Section component of the course,116,40,35,17,7,1,4.06,4.27
