Question,Count,Excellent (%),Very Good (%),Good (%),Fair (%),Unsatisfactory (%),Course Mean,FAS Mean
Evaluate the course overall.,110,35,25,25,11,5,3.74,4.26
"Course materials (readings, audio-visual materials, textbooks, lab manuals, website, etc.)",104,33,27,32,6,3,3.81,4.24
"Assignments (exams, essays, problem sets, language homework, etc.)",104,29,27,25,14,5,3.61,4.14
Feedback you received on work you produced in this course,105,29,21,33,10,7,3.54,4.14
Section component of the course,97,55,18,13,5,9,4.03,4.29
