Question,Count,Excellent (%),Very Good (%),Good (%),Fair (%),Unsatisfactory (%),Course Mean,FAS Mean
Evaluate the course overall.,20,70%,25%,5%,0%,0%,4.65,4.26
"Course materials (readings, audio-visual materials, textbooks, lab manuals, website, etc.)",20,60%,30%,5%,5%,0%,4.45,4.24
"Assignments (exams, essays, problem sets, language homework, etc.)",20,65%,30%,5%,0%,0%,4.6,4.14
Feedback you received on work you produced in this course,19,68%,26%,5%,0%,0%,4.63,4.14
Section component of the course,15,60%,27%,13%,0%,0%,4.47,4.29