Question,Count,Excellent (%),Very Good (%),Good (%),Fair (%),Unsatisfactory (%),Course Mean,FAS Mean
Evaluate the course overall.,35,37%,37%,20%,3%,3%,4.03,4.26
"Course materials (readings, audio-visual materials, textbooks, lab manuals, website, etc.)",35,46%,46%,6%,3%,0%,4.34,4.24
"Assignments (exams, essays, problem sets, language homework, etc.)",35,40%,46%,14%,0%,0%,4.26,4.14
Feedback you received on work you produced in this course,35,51%,31%,11%,6%,0%,4.29,4.14
Section component of the course,34,56%,32%,9%,3%,0%,4.41,4.29