Question,Count,Excellent,Very Good,Good,Fair,Unsatisfactory,Course Mean,FAS Mean
Evaluate the course overall.,69,59%,26%,13%,1%,0%,4.43,4.26
"Course materials (readings, audio-visual materials, textbooks, lab manuals, website, etc.)",68,54%,24%,19%,3%,0%,4.29,4.24
"Assignments (exams, essays, problem sets, language homework, etc.)",69,55%,32%,7%,6%,0%,4.36,4.14
Feedback you received on work you produced in this course,69,62%,20%,9%,4%,4%,4.32,4.14
Section component of the course,69,78%,12%,6%,4%,0%,4.64,4.29